<?xml version="1.0" encoding="UTF-8"?>
<calendario xmlns:xsi="http://www.w3.org/2001/XMLSchema-instance" xsi:noNamespaceSchemaLocation="calendario.xsd">
    <trimestre ciclo="primero">
        <asignatura nombre="LLMM">
            <tema tema="4">
                <nombre>RSS</nombre>
                <notamedia>
                    <teoria>5.5</teoria>
                    <practica>5.5</practica>
                </notamedia>
            </tema>
            <tema tema="5">
                <nombre>Schema</nombre>
                <notamedia>
                    <teoria>5.5</teoria>
                    <practica>5.5</practica>
                </notamedia>
            </tema>
            <fechaExamenes>2021-11-09</fechaExamenes>
        </asignatura>
        <asignatura nombre="PLAR">
            <tema tema="5">
                <nombre>vlan</nombre>
                <notamedia>
                    <teoria>5.5</teoria>
                    <practica>5.5</practica>
                </notamedia>
            </tema>
            <tema tema="6">
                <nombre>Switch</nombre>
                <notamedia>
                    <teoria>5.5</teoria>
                    <practica>5.5</practica>
                </notamedia>
            </tema>
            <fechaExamenes>2022-02-14</fechaExamenes>
        </asignatura>
    </trimestre>
</calendario>